{
  "$schema": "https://json-schema.org/draft/2020-12/schema",
  "$id": "https://queryunstuck/content-spec.schema.json",
  "title": "QueryUnstuck content piece",
  "type": "object",
  "required": [
    "id",
    "slug",
    "title",
    "format",
    "pillar",
    "status",
    "scheduled_for",
    "history"
  ],
  "additionalProperties": false,
  "properties": {
    "id": {
      "type": "string",
      "pattern": "^qu-[0-9]{3,}$"
    },
    "slug": {
      "type": "string",
      "pattern": "^[a-z0-9]+(-[a-z0-9]+)*$"
    },
    "title": {
      "type": "string",
      "minLength": 5,
      "maxLength": 100
    },
    "format": {
      "enum": [
        "reel-animated",
        "reel-list",
        "longform",
        "short"
      ]
    },
    "pillar": {
      "enum": [
        "data-engineering",
        "data-analysis",
        "ai-ml",
        "data-system-design"
      ]
    },
    "status": {
      "enum": [
        "idea",
        "researched",
        "scripted",
        "fact-checked",
        "storyboarded",
        "rendered",
        "qa-passed",
        "copy-ready",
        "in-review",
        "approved",
        "scheduled",
        "published",
        "blocked"
      ]
    },
    "audience_level": {
      "enum": [
        "beginner",
        "intermediate",
        "advanced"
      ]
    },
    "hook": {
      "type": "string",
      "maxLength": 120
    },
    "hook_options": {
      "type": "array",
      "items": {
        "type": "string",
        "maxLength": 120
      },
      "maxItems": 5
    },
    "target_duration_sec": {
      "type": "number",
      "minimum": 5,
      "maximum": 1500
    },
    "scheduled_for": {
      "type": "string",
      "pattern": "^\\d{4}-\\d{2}-\\d{2}T\\d{2}:\\d{2}(:\\d{2})?([+-]\\d{2}:\\d{2})$"
    },
    "parent_id": {
      "type": "string",
      "pattern": "^qu-[0-9]{3,}$",
      "description": "Longform this reel was cut from, if any"
    },
    "sources": {
      "type": "array",
      "items": {
        "type": "object",
        "required": [
          "claim",
          "url",
          "type"
        ],
        "additionalProperties": false,
        "properties": {
          "claim": {
            "type": "string"
          },
          "url": {
            "type": "string",
            "pattern": "^https?://"
          },
          "type": {
            "enum": [
              "primary",
              "secondary"
            ]
          },
          "accessed": {
            "type": "string",
            "pattern": "^\\d{4}-\\d{2}-\\d{2}$"
          }
        }
      }
    },
    "scenes": {
      "type": "array",
      "items": {
        "type": "object",
        "required": [
          "id",
          "duration_sec",
          "on_screen_text"
        ],
        "additionalProperties": false,
        "properties": {
          "id": {
            "type": "string"
          },
          "chapter": {
            "type": "string"
          },
          "duration_sec": {
            "type": "number",
            "exclusiveMinimum": 0,
            "maximum": 120
          },
          "beat": {
            "type": "string"
          },
          "on_screen_text": {
            "type": "array",
            "items": {
              "type": "string",
              "maxLength": 60
            },
            "maxItems": 6
          },
          "narration": {
            "type": "string"
          },
          "component": {
            "enum": [
              "TitleCard",
              "ListCard",
              "CodePanel",
              "DataTable",
              "RowHighlight",
              "JoinMatcher",
              "WindowFrame",
              "FlowGraph",
              "PartitionGrid",
              "Comparison",
              "Timeline",
              "Callout",
              "EndCard"
            ]
          },
          "props": {
            "type": "object"
          },
          "code_block": {
            "type": "integer",
            "minimum": 0,
            "description": "Index into code_blocks shown alongside"
          }
        }
      }
    },
    "code_blocks": {
      "type": "array",
      "items": {
        "type": "object",
        "required": [
          "lang",
          "code"
        ],
        "additionalProperties": false,
        "properties": {
          "lang": {
            "enum": [
              "sql",
              "python",
              "dax",
              "yaml",
              "bash",
              "text"
            ]
          },
          "dialect": {
            "type": "string"
          },
          "setup": {
            "type": "string"
          },
          "code": {
            "type": "string"
          },
          "expected_output": {
            "type": "string"
          },
          "verified": {
            "type": "boolean"
          },
          "needs_manual_check": {
            "type": "boolean"
          }
        }
      }
    },
    "music": {
      "type": "object",
      "additionalProperties": false,
      "required": [
        "bed"
      ],
      "description": "Background music bed (original, from video/public/music). Set by the composer.",
      "properties": {
        "bed": {
          "type": "string",
          "pattern": "^[a-z0-9-]+$",
          "description": "Bed name in video/public/music/manifest.json"
        },
        "gain_db": {
          "type": "number",
          "minimum": -40,
          "maximum": 0,
          "description": "Bed level relative to the stored loop (default brand.audio.musicGainDb)"
        },
        "duck_db": {
          "type": "number",
          "minimum": 0,
          "maximum": 12,
          "description": "How far the bed dips under each sound effect (default brand.audio.duckDb)"
        },
        "sync": {
          "type": "boolean",
          "description": "Snap scene changes and steps to the bed's beat grid (default true)"
        },
        "rationale": {
          "type": "string",
          "maxLength": 300
        },
        "track": {
          "type": "string",
          "pattern": "^pieces/[a-z0-9-]+\\.wav$",
          "description": "Exact-length track rendered by video/scripts/render_music.py (git-ignored, regenerable)"
        }
      }
    },
    "needs_new_component": {
      "type": "string"
    },
    "thumbnail": {
      "type": "object",
      "additionalProperties": false,
      "properties": {
        "frame": {
          "type": "integer",
          "minimum": 0
        },
        "url": {
          "type": "string"
        }
      }
    },
    "render": {
      "type": "object",
      "additionalProperties": false,
      "properties": {
        "reel_url": {
          "type": "string",
          "pattern": "^https://"
        },
        "longform_url": {
          "type": "string",
          "pattern": "^https://"
        },
        "srt_path": {
          "type": "string"
        },
        "duration_sec": {
          "type": "number"
        }
      }
    },
    "publish": {
      "type": "object",
      "additionalProperties": false,
      "properties": {
        "instagram": {
          "$ref": "#/$defs/platform"
        },
        "youtube": {
          "$ref": "#/$defs/platform"
        },
        "youtube_short": {
          "$ref": "#/$defs/platform"
        }
      }
    },
    "history": {
      "type": "array",
      "items": {
        "type": "object",
        "required": [
          "at",
          "agent",
          "action"
        ],
        "additionalProperties": false,
        "properties": {
          "at": {
            "type": "string"
          },
          "agent": {
            "type": "string"
          },
          "action": {
            "type": "string"
          },
          "note": {
            "type": "string"
          }
        }
      }
    }
  },
  "$defs": {
    "platform": {
      "type": "object",
      "additionalProperties": false,
      "properties": {
        "enabled": {
          "type": "boolean"
        },
        "privacy": {
          "enum": [
            "public",
            "unlisted",
            "private"
          ]
        },
        "post_id": {
          "type": "string"
        },
        "permalink": {
          "type": "string"
        },
        "published_at": {
          "type": "string"
        },
        "error": {
          "type": "string"
        }
      }
    }
  }
}
