{
  "id": "qu-000",
  "slug": "demo-components",
  "title": "Component gallery (engine demo)",
  "format": "reel-animated",
  "pillar": "data-engineering",
  "status": "storyboarded",
  "scheduled_for": "2026-10-03T12:00:00+05:30",
  "code_blocks": [
    {
      "lang": "sql",
      "code": "SELECT order_day, amount,\n  SUM(amount) OVER (\n    ORDER BY order_day\n    ROWS BETWEEN 2 PRECEDING AND CURRENT ROW\n  ) AS rolling_3\nFROM daily_sales;"
    },
    {
      "lang": "python",
      "code": "def partition_for(key: int, n: int = 3) -> int:\n    # toy partitioner for the demo\n    return key % n"
    }
  ],
  "scenes": [
    {
      "id": "g1-list",
      "duration_sec": 4,
      "on_screen_text": ["5 Must-Know Window Functions"],
      "component": "ListCard",
      "props": {
        "title": "5 Must-Know Window Functions",
        "items": ["ROW_NUMBER()", "RANK()", {"text": "DENSE_RANK()", "note": "no gaps"}, "LAG()", "LEAD()"],
        "activeIndex": 2
      }
    },
    {
      "id": "g2-join",
      "duration_sec": 6,
      "on_screen_text": ["INNER JOIN", "Keep only rows with a match on both sides"],
      "component": "JoinMatcher",
      "props": {
        "left": {"name": "orders", "columns": ["id", "cust_id"], "rows": [[1, 10], [2, 20], [3, 10], [4, 40]], "key": "cust_id"},
        "right": {"name": "customers", "columns": ["id", "name"], "rows": [[10, "ana"], [20, "ben"], [30, "cara"]], "key": "id"},
        "joinType": "inner"
      }
    },
    {
      "id": "g3-window",
      "duration_sec": 7,
      "on_screen_text": ["Rolling 3-row sum", "The frame slides one row at a time"],
      "component": "WindowFrame",
      "code_block": 0,
      "props": {
        "columns": ["order_day", "amount"],
        "rows": [["d1", 10], ["d2", 20], ["d3", 30], ["d4", 40], ["d5", 50]],
        "valueColumn": "amount",
        "aggregate": "sum",
        "preceding": 2,
        "following": 0,
        "outputColumn": "rolling_3",
        "label": "ROWS 2 PRECEDING → CURRENT ROW",
        "codeHighlight": {"activeLines": [2, 3, 4, 5]}
      }
    },
    {
      "id": "g4-flow",
      "duration_sec": 5,
      "on_screen_text": ["A batch pipeline", "Data moves left to right, stage by stage"],
      "component": "FlowGraph",
      "props": {
        "nodes": [
          {"id": "src", "label": "Source", "sublabel": "app DB", "x": 0, "y": 0.1},
          {"id": "ing", "label": "Ingest", "sublabel": "raw", "x": 1, "y": 0.1},
          {"id": "tr", "label": "Transform", "sublabel": "clean + model", "x": 0, "y": 0.9, "tone": "active"},
          {"id": "wh", "label": "Warehouse", "sublabel": "tables", "x": 1, "y": 0.9}
        ],
        "edges": [
          {"from": "src", "to": "ing", "label": "extract"},
          {"from": "ing", "to": "tr", "colorIndex": 1},
          {"from": "tr", "to": "wh", "label": "load", "colorIndex": 3}
        ]
      }
    },
    {
      "id": "g5-partition",
      "duration_sec": 6,
      "on_screen_text": ["Shuffle", "Each key moves to partition key % 3"],
      "component": "PartitionGrid",
      "code_block": 1,
      "props": {
        "partitions": ["P0", "P1", "P2"],
        "beforeLabel": "before shuffle",
        "afterLabel": "after shuffle: key % 3",
        "items": [
          {"label": "k=1", "from": 0, "to": 1}, {"label": "k=3", "from": 0, "to": 0}, {"label": "k=5", "from": 0, "to": 2},
          {"label": "k=2", "from": 1, "to": 2}, {"label": "k=6", "from": 1, "to": 0}, {"label": "k=4", "from": 1, "to": 1},
          {"label": "k=7", "from": 2, "to": 1}, {"label": "k=8", "from": 2, "to": 2}, {"label": "k=9", "from": 2, "to": 0}
        ]
      }
    },
    {
      "id": "g6-compare",
      "duration_sec": 6,
      "on_screen_text": ["WHERE vs HAVING", "Same idea, different moment"],
      "component": "Comparison",
      "props": {
        "left": {"title": "WHERE", "points": ["Filters rows", "Runs before GROUP BY", "No aggregates"]},
        "right": {"title": "HAVING", "points": ["Filters groups", "Runs after GROUP BY", "Aggregates allowed"], "tone": "active"},
        "verdict": "Rows → WHERE. Groups → HAVING."
      }
    },
    {
      "id": "g7-timeline",
      "duration_sec": 6,
      "on_screen_text": ["Logical order", "How the engine reasons about a SELECT"],
      "component": "Timeline",
      "props": {
        "events": [
          {"label": "FROM / JOIN", "detail": "build the row set"},
          {"label": "WHERE", "detail": "filter rows"},
          {"label": "GROUP BY", "detail": "make groups"},
          {"label": "HAVING", "detail": "filter groups"},
          {"label": "SELECT", "detail": "compute columns"},
          {"label": "ORDER BY", "detail": "sort"},
          {"label": "LIMIT", "detail": "trim"}
        ]
      }
    },
    {
      "id": "g8-callout",
      "duration_sec": 4,
      "on_screen_text": ["Interview tip"],
      "component": "Callout",
      "props": {"text": "Filter rows in WHERE, filter groups in HAVING.", "tone": "tip", "detail": "Filtering early means less data to group."}
    }
  ],
  "history": [{"at": "2026-10-03T12:00:00+05:30", "agent": "animator", "action": "created component gallery demo"}]
}
